gene,onco_tsg,pathways,main_pathway,protein_type,cellular_location,immune_evasion,functional_role,citation,databases_used
DGCR8,Neither (context-dependent),"DNA Damage Repair, Chromatin Remodeling/Epigenetic Regulation, Spliceosome/Splicing",chromatin remodeling/epigenetic regulation,"RNA-binding protein, miRNA biogenesis","Nucleus (nucleoplasm, nucleolus)",No,Essential for microRNA processing as part of the Microprocessor complex; also involved in DNA repair and RNA stability,[5][6][8],"NCBI Gene, UniProt, HPA, GeneCards"
GDF7,Neither (context-dependent),"TGFB, EMT/Metastasis, Cell Cycle",tgfb,Secreted growth factor (TGF-β family),Extracellular (secreted),No,Induces tendon/ligament differentiation; may influence cell proliferation and differentiation,[Expert knowledge],"UniProt, GeneCards"
GPHN,Tumor Suppressor (putative),"Chromatin Remodeling/Epigenetic Regulation, Spliceosome/Splicing",chromatin remodeling/epigenetic regulation,Scaffolding protein,"Cytoplasm, postsynaptic membrane",No,Anchors inhibitory neurotransmitter receptors; may regulate synaptic signaling and chromatin structure,[Expert knowledge],"UniProt, GeneCards"
IRF2,Tumor Suppressor (context-dependent),"Interferon Signaling, Cell Cycle, Apoptosis, Antigen Presentation",interferon signaling,Transcription factor,Nucleus,Yes (regulates immune genes),"Regulates interferon-responsive genes, modulates immune response, cell growth, and apoptosis",[Expert knowledge],"UniProt, GeneCards"
MAP3K13,Oncogene,"MAPK/ERK, NF-kB, Apoptosis, Cell Cycle",mapk/erk,Serine/threonine kinase,"Cytoplasm, nucleus",No,"Activates JNK and NF-kB pathways, promoting cell proliferation and survival",[Expert knowledge],"UniProt, GeneCards"
NHLH1,Oncogene (putative),"Myc, Cell Cycle, Chromatin Remodeling/Epigenetic Regulation",myc,Basic helix-loop-helix transcription factor,Nucleus,No,Regulates neuronal differentiation and may influence cell proliferation,[Expert knowledge],"UniProt, GeneCards"
PIK3R4,Oncogene (context-dependent),"PI3K, Autophagy, Ubiquitination/Proteostasis",pi3k,Regulatory subunit of PI3K complex,Cytoplasm,No,Regulates autophagy and endosomal trafficking as part of the PI3K complex,[Expert knowledge],"UniProt, GeneCards"
**POLD3**,Tumor Suppressor,"DNA Damage Response, DNA Damage Repair, Cell Cycle, Chromatin Remodeling/Epigenetic Reg.",dna damage repair,DNA polymerase delta/ zeta subunit,Nucleus,No,"Essential for DNA replication and repair, maintains genome stability, prevents chromosomal rearrangements and instability",[1][2][4],"PubMed, TCGA, GTEx"
**SH2B3**,Tumor Suppressor,"JAK/STAT, Immune Signaling, Apoptosis",jak/stat,Adaptor protein (signal transduction),"Cytoplasm, Plasma Membrane",Yes,"Negative regulator of cytokine signaling, modulates immune cell development and function, suppresses tumorigenesis",[NCBI Gene][UniProt],"NCBI Gene, UniProt"
**ATG7**,Tumor Suppressor (context-dependent),"Autophagy, Apoptosis, Cell Cycle, NF-kB, Antigen Presentation, Metabolism",autophagy,E1-like enzyme (autophagy-related),Cytoplasm,Yes,"Essential for autophagosome formation, regulates cell survival, death, immunity, and antigen presentation",[5][8][10],"PubMed, TCGA"
**DVL1**,Oncogene,"WNT, Cell Cycle, EMT/Metastasis, Chromatin Remodeling/Epigenetic Reg.",wnt,Signal transduction adaptor (Dishevelled),"Cytoplasm, Nucleus",No,"Mediates WNT signaling, regulates cell proliferation, differentiation, and migration",[KEGG][UniProt],"KEGG, UniProt"
**EGFR_EGFR**,Oncogene,"RTK/RAS, MAPK/ERK, PI3K, Cell Cycle, Apoptosis, Angiogenesis, EMT/Metastasis",rtk/ras,Receptor tyrosine kinase,Plasma Membrane,Yes,"Drives cell proliferation, survival, and migration via multiple downstream pathways; promotes immune evasion",[KEGG][UniProt],"KEGG, UniProt"
**IL1B**,Oncogene (context-dependent),"NF-kB, JAK/STAT, Apoptosis, Immune Signaling, EMT/Metastasis, Angiogenesis",nf-kb,Cytokine (pro-inflammatory),"Secreted, Cytoplasm",Yes,"Promotes inflammation, tumor progression, angiogenesis, and immune modulation",[KEGG][UniProt],"KEGG, UniProt"
**LPP**,Oncogene,"EMT/Metastasis, Cell Cycle, Chromatin Remodeling/Epigenetic Reg.",emt/metastasis,LIM domain-containing adaptor protein,"Nucleus, Cytoplasm",No,"Regulates cell adhesion, motility, and transcription; involved in metastasis",[NCBI Gene][UniProt],"NCBI Gene, UniProt"
**MAFB**,Tumor Suppressor,"Cell Cycle, Chromatin Remodeling/Epigenetic Reg., Immune Signaling",chromatin remodeling/epigenetic regulation,Transcription factor (bZIP family),Nucleus,No,"Regulates differentiation, cell cycle, and immune cell development",[NCBI Gene][UniProt],"NCBI Gene, UniProt"
MYCL,Oncogene,"Myc, JAK/STAT, Cell Cycle, Apoptosis, EMT/Metastasis",myc,Transcription factor (bHLH),Nucleus,Yes,"Promotes proliferation, migration, invasion; regulates cell cycle, apoptosis, and metastasis",[2][3][5],"PubMed, cBioPortal, Wikipedia"
PRSS56,Oncogene,"PI3K, Ubiquitination/Proteostasis, Chromatin Remodeling/Epigenetic Regulation",pi3k,Serine protease (trypsin-like),Secreted/Extracellular,No,"Promotes proliferation, migration, invasion via PI3K/AKT; cancer-testis antigen",[6][8][9],"PubMed, Human Protein Atlas"
SRC,Oncogene,"RTK/RAS, MAPK/ERK, PI3K, Cell Cycle, Apoptosis, EMT/Metastasis, Angiogenesis",rtk/ras,Non-receptor tyrosine kinase,"Cytoplasm, Membrane",Yes,"Regulates proliferation, survival, migration, angiogenesis, and immune evasion",(Expert knowledge),"UniProt, PubMed"
TGIF1,Tumor Suppressor (context-dependent),"TGFB, WNT, Chromatin Remodeling/Epigenetic Regulation, Cell Cycle",tgfb,Homeobox transcriptional repressor,Nucleus,No,"Modulates TGF-β signaling, represses transcription, regulates cell differentiation and proliferation",(Expert knowledge),"GeneCards, PubMed"
TTC3,Tumor Suppressor (putative),"Ubiquitination/Proteostasis, DNA Damage Response, Apoptosis",ubiquitination/proteostasis,E3 ubiquitin ligase (Tetratricopeptide repeat),"Cytoplasm, Nucleus",No,"E3 ligase involved in protein degradation, cell cycle, and neuronal development",(Expert knowledge),"UniProt, GeneCards"
VPS37B,Tumor Suppressor (putative),"Ubiquitination/Proteostasis, Endosomal Sorting, Antigen Presentation",ubiquitination/proteostasis,ESCRT-I complex subunit,"Cytoplasm, Endosome",Yes (indirect),"Involved in endosomal sorting, MHC class I antigen presentation, and proteostasis",(Expert knowledge),"UniProt, GeneCards"
ZEB1,Oncogene (context-dependent),"EMT/Metastasis, WNT, TGFB, Chromatin Remodeling/Epigenetic Regulation, Apoptosis",emt/metastasis,Transcription factor (zinc finger),Nucleus,Yes,"Master regulator of EMT, promotes metastasis, represses epithelial genes, modulates immune response",(Expert knowledge),"PubMed, UniProt"
ADNP,Oncogene (context-dependent),"Chromatin Remodeling/Epigenetic Regulation, Cell Cycle, DNA Damage Response",chromatin remodeling/epigenetic regulation,Transcription factor/chromatin regulator,Nucleus,No,"Regulates chromatin structure, neurodevelopment, cell proliferation, and DNA repair",(Expert knowledge),"PubMed, GeneCards"
C21orf91,Oncogene,"PI3K, MAPK/ERK",pi3k,Regulatory protein,Nucleus,No,"Plays a role in cortical progenitor cell proliferation and differentiation. Promotes dendritic spine development of post-migratory cortical projection neurons. In triple-negative breast cancer, upregulation of C21orf91 activates PI3K-AKT-GSK3β-β-catenin and MAPK pathways, promoting tumor progression.[1][2]",Long Non-coding RNA BTG3-7:1 and JUND Co-regulate C21ORF91 to Promote Proliferation and Metastasis in Triple-negative Breast Cancer (2021),"GeneCards, PubMed, Harmonizome"
CCDC43,Oncogene,Ubiquitination/Proteostasis,ubiquitination/proteostasis,Coiled-coil domain containing protein,Intracellular,No,"Promotes proliferation and metastasis in gastric cancer by upregulating and stabilizing ADRM1, resulting in the construction of the ubiquitin-mediated proteasome. The CCDC43-ADRM1 axis is regulated by transcription factor YY1.[6][8]","The CCDC43-ADRM1 axis regulated by YY1, promotes proliferation and metastasis of gastric cancer (2020)","PubMed, Human Protein Atlas, Harmonizome"
CHEK1,Oncogene,DNA Damage Response,dna damage response,Kinase,Nucleus,No,Information not available in search results,Information not available in search results,Information not available in search results
E2F1,Oncogene,Cell Cycle,cell cycle,Transcription factor,Nucleus,No,Information not available in search results,Information not available in search results,Information not available in search results
IMMP2L,Tumor Suppressor (putative),"Apoptosis, Senescence, Metabolism, Mitochondrial Function",apoptosis,Mitochondrial inner membrane peptidase,Mitochondria (inner membrane),No,"Processes mitochondrial proteins (e.g., GPD2, AIF), regulates cell fate between apoptosis and senescence, impacts metabolism and aging.",[1][2][5][10],"GeneCards, UniProt, PubMed, PMC"
KAT7,Chromatin Regulator,"Chromatin Remodeling/Epigenetic Regulation, Cell Cycle",chromatin remodeling/epigenetic regulation,Histone acetyltransferase,Nucleus,No,"Acetylates histones, regulates gene expression, cell cycle progression, and DNA repair.",(inferred),"GeneCards, UniProt, PubMed"
MINAR1,Unknown,"PI3K, RTK/RAS, Metabolism (regulation of mTOR pathway)",pi3k,Transmembrane protein (mTOR regulator),Endoplasmic reticulum,No,"Regulates mTOR signaling, influences cell growth and metabolism.",(inferred),"GeneCards, UniProt, PubMed"
NOL4L,Unknown,"Cell Cycle, Ribosome Biogenesis",cell cycle,Nucleolar protein,Nucleolus,No,Involved in ribosome biogenesis and cell proliferation.,(inferred),"GeneCards, UniProt, PubMed"
OR7E24,Unknown,Not established in cancer pathways,unknown,Olfactory receptor (GPCR),Plasma membrane,No,"G-protein coupled receptor, likely not involved in cancer.",(inferred),"GeneCards, UniProt, PubMed"
PARD6G,Tumor Suppressor (putative),"EMT/Metastasis, Cell Polarity, PI3K, Cell Cycle",emt/metastasis,Scaffold protein (PAR complex component),"Cytoplasm, cell junctions",No,"Regulates cell polarity, tight junction assembly, and may suppress EMT/metastasis.",(inferred),"GeneCards, UniProt, PubMed"
PHF2,Tumor Suppressor,"Chromatin Remodeling/Epigenetic Regulation, TP53, Cell Cycle",chromatin remodeling/epigenetic regulation,Histone demethylase,Nucleus,No,"Demethylates histones, regulates gene expression, interacts with TP53, and suppresses tumorigenesis.",(inferred),"GeneCards, UniProt, PubMed"
PLXNB3,Oncogene (putative),"EMT/Metastasis, RTK/RAS, MAPK/ERK",emt/metastasis,Transmembrane receptor (Plexin family),Plasma membrane,No,"Receptor for semaphorins, regulates cell migration, invasion, and metastasis.",(inferred),"GeneCards, UniProt, PubMed"
RNF111,Tumor Suppressor,"TGFB, Ubiquitination/Proteostasis, DNA Damage Response",tgfb,E3 ubiquitin ligase (Arkadia),Nucleus,No,"Enhances TGF-β signaling by targeting repressors (SnoN/Ski) for degradation, supporting tumor suppression",[2],"NCBI, OMIM, OncoKB"
SLC3A2,Oncogene,"RTK/RAS, PI3K, Metabolism",rtk/ras,Amino acid transporter (CD98 heavy chain),Membrane,Yes,"Promotes cell growth, integrin signaling, and amino acid transport; implicated in tumor progression and immune evasion",[9] (OncoKB),"OncoKB, GeneCards, NCBI"
SUZ12,Oncogene,"Chromatin Remodeling/Epigenetic Regulation, Apoptosis",chromatin remodeling/epigenetic regulation,Polycomb group protein (PRC2 subunit),Nucleus,No,"Core PRC2 component, mediates H3K27 trimethylation, gene silencing, promotes proliferation, inhibits apoptosis",[10],"NCBI, OMIM, OncoKB, CancerIndex"
TCERG1,Oncogene,"Spliceosome/Splicing, Transcriptional Regulation",spliceosome/splicing,Transcription elongation and splicing factor,Nucleus,No,"Regulates transcription elongation and pre-mRNA splicing, modulates gene expression",[9] (OncoKB),"OncoKB, GeneCards, NCBI"
WNT16,Oncogene,"WNT, Cell Cycle, EMT/Metastasis",wnt,Secreted glycoprotein (Wnt family),Secreted/Extracellular,No,"Activates canonical and non-canonical Wnt signaling, regulates cell fate, proliferation, and migration",[9] (OncoKB),"OncoKB, GeneCards, NCBI"
WRN,Tumor Suppressor,"DNA Damage Repair, DNA Damage Response, Cell Cycle",dna damage repair,RecQ helicase (DNA repair enzyme),Nucleus,No,"Maintains genome stability, DNA repair, replication, and telomere maintenance",[9] (OncoKB),"OncoKB, GeneCards, NCBI"
ZBTB7B,Tumor Suppressor,"TP53, Chromatin Remodeling/Epigenetic Regulation, Cell Cycle",tp53,Transcription factor (POK family),Nucleus,Yes,"Regulates T-cell development, represses oncogenic pathways, modulates immune response",[9] (OncoKB),"OncoKB, GeneCards, NCBI"
ALB,Neither (Housekeeping),Metabolism,metabolism,Serum albumin (carrier protein),Extracellular (plasma),No,"Maintains osmotic pressure, transports hormones, fatty acids, and drugs",[9] (OncoKB),"OncoKB, GeneCards, NCBI"
CEL,Unclear/Not classified,Not well-established in major cancer pathways,unknown,Digestive enzyme (carboxyl ester lipase),Secreted (extracellular),No,Hydrolyzes dietary fats; not directly implicated in cancer pathways,[1][2][5],"NCBI Gene, UniProt"
DLGAP3,Unclear/Not classified,Not well-established in major cancer pathways,unknown,Scaffold protein (postsynaptic density),"Cytoplasm, synapse",No,Synaptic organization; no direct evidence for oncogenic or tumor suppressor function,[1][2][5],"NCBI Gene, UniProt"
EBPL,Unclear/Not classified,Not well-established in major cancer pathways,unknown,Lipid-binding protein,Cytoplasm,No,May be involved in lipid transport; no direct evidence for cancer role,[1][2][5],"NCBI Gene, UniProt"
EZH2,Oncogene,"Chromatin Remodeling/Epigenetic Regulation, Cell Cycle, Apoptosis, EMT/Metastasis",chromatin remodeling/epigenetic regulation,Histone methyltransferase (PRC2 component),Nucleus,Yes,"Catalyzes H3K27 methylation, represses tumor suppressor genes, promotes proliferation and metastasis",[1][2][5],"NCBI Gene, UniProt, COSMIC"
HOXC13,Oncogene (context-dependent),"Chromatin Remodeling/Epigenetic Regulation, Cell Cycle",chromatin remodeling/epigenetic regulation,Homeobox transcription factor,Nucleus,No,Regulates gene expression in development; aberrant expression linked to some cancers,[1][2][5],"NCBI Gene, UniProt"
JUN,Oncogene,"MAPK/ERK, Apoptosis, Cell Cycle, EMT/Metastasis",mapk/erk,Transcription factor (AP-1 complex),Nucleus,Yes (indirect),"Regulates proliferation, apoptosis, and transformation; overactive in many cancers",[1][2][5],"NCBI Gene, UniProt, COSMIC"
LSAMP,Tumor Suppressor,"Cell Adhesion, EMT/Metastasis",emt/metastasis,Cell adhesion molecule (Ig superfamily),Membrane,No,Inhibits cell proliferation and migration; loss linked to tumor progression,[1][2][5],"NCBI Gene, UniProt"
N4BP2,Unclear/Not classified,"DNA Damage Response, Ubiquitination/Proteostasis (putative)",dna damage response,NEDD4-binding protein,"Nucleus, cytoplasm",No,May be involved in DNA repair and ubiquitin pathways; limited direct evidence in cancer,[1][2][5],"NCBI Gene, UniProt"
POLQ,Oncogene,"DNA Damage Response, DNA Damage Repair, Cell Cycle, Apoptosis, TP53",dna damage repair,DNA polymerase with helicase activity,"Nucleus (main), cytoplasm",No,"Error-prone DNA polymerase involved in theta-mediated end joining (TMEJ), repairs double-strand breaks, promotes radioresistance, and is upregulated in many cancers.",[1][3][5][6][10],"UniProt, NCBI Gene, Human Protein Atlas"
PRDM2,Tumor Suppressor,"Chromatin Remodeling/Epigenetic Regulation, TP53, Cell Cycle",chromatin remodeling/epigenetic regulation,Histone methyltransferase (PR/SET domain),Nucleus,No,"Regulates chromatin structure and gene expression, interacts with p53, suppresses tumor growth.",[4],"UniProt, NCBI Gene"
TMEM30A,Tumor Suppressor,"Apoptosis, Cell Cycle, Metabolism",apoptosis,Membrane protein (phospholipid flippase subunit),Plasma membrane,No,"Maintains phospholipid asymmetry in membranes, loss leads to apoptosis and impaired cell survival.",[4],"UniProt, NCBI Gene"
TNKS2,Oncogene,"WNT, RTK/RAS, Ubiquitination/Proteostasis, Cell Cycle",wnt,Poly(ADP-ribose) polymerase (PARP family),"Cytoplasm, nucleus",No,"Regulates WNT signaling, telomere maintenance, and protein degradation via ubiquitination.",[4],"UniProt, NCBI Gene"
TRAF7,Tumor Suppressor,"NF-kB, Apoptosis, Ubiquitination/Proteostasis",nf-kb,E3 ubiquitin ligase,Cytoplasm,No,"Mediates ubiquitination, regulates NF-kB signaling, and apoptosis; mutations linked to meningioma.",[4],"UniProt, NCBI Gene"
ATP2A1,Neither (Context-dependent),"Metabolism, Apoptosis",metabolism,Calcium ATPase (SERCA1),Sarcoplasmic/endoplasmic reticulum,No,"Pumps Ca2+ into the sarcoplasmic reticulum, regulates muscle contraction and cellular metabolism.",[4],"UniProt, NCBI Gene"
ETS2,Oncogene,"Cell Cycle, Apoptosis, TP53, MAPK/ERK",cell cycle,Transcription factor (ETS family),Nucleus,No,"Regulates gene expression in cell proliferation, differentiation, and apoptosis; interacts with p53.",[4],"UniProt, NCBI Gene"
FHOD3,Tumor Suppressor,"EMT/Metastasis, Cell Cycle, Cytoskeleton",emt/metastasis,Actin-binding protein (formin family),Cytoplasm,No,"Regulates actin filament assembly, cell shape, and motility; loss promotes metastasis.",[4],"UniProt, NCBI Gene"
GPC5,Tumor Suppressor,"WNT, EMT/Metastasis",wnt,Heparan sulfate proteoglycan,Cell membrane,No,Inhibits tumor growth and metastasis by suppressing Wnt/β-catenin signaling and affecting EMT/Metastasis,[1][2][3][6],"PubMed, Infinome"
PTPRT,Tumor Suppressor,"JAK/STAT, RTK/RAS, MAPK/ERK",jak/stat,Receptor-type protein tyrosine phosphatase,Cell membrane,No,"Negatively regulates STAT3 signaling, suppresses cell proliferation and migration",[5] (general TSG info),"Wikipedia, PubMed"
RGS9BP,Not classified,Not established in major cancer pathways,unknown,Regulator of G-protein signaling binding protein,"Cytoplasm, membrane",No,"Modulates G-protein signaling, mainly in retina; no established cancer role",[5] (general info),"Wikipedia, PubMed"
RPS6KA3,Oncogene,"MAPK/ERK, Cell Cycle",mapk/erk,Serine/threonine kinase,"Cytoplasm, nucleus",No,Mediates cell growth and proliferation via MAPK/ERK pathway,[5] (general info),"Wikipedia, PubMed"
RSPO3,Oncogene,"WNT, Angiogenesis",wnt,Secreted protein (Wnt agonist),"Extracellular, membrane",No,"Potentiates Wnt/β-catenin signaling, promotes angiogenesis and tumor growth",[5] (general info),"Wikipedia, PubMed"
ZNF469,Not classified,Chromatin Remodeling/Epigenetic Regulation,chromatin remodeling/epigenetic regulation,Zinc finger protein,Nucleus,No,Regulates extracellular matrix gene expression; no direct cancer pathway established,[5] (general info),"Wikipedia, PubMed"
B4GALNT1,Not classified,Metabolism,metabolism,Glycosyltransferase,Golgi apparatus,No,Involved in ganglioside biosynthesis; no direct cancer pathway established,[5] (general info),"Wikipedia, PubMed"
BRSK1,Tumor Suppressor (putative),"Cell Cycle, DNA Damage Response",cell cycle,Serine/threonine kinase,"Cytoplasm, nucleus",No,Regulates cell cycle checkpoints and neuronal polarization; possible tumor suppressor role,[5] (general info),"Wikipedia, PubMed"
HMMR,Oncogene,"Cell Cycle, DNA Damage Response, EMT/Metastasis, Chromatin Remodeling/Epigenetic Regulation",cell cycle,Hyaluronan-mediated motility receptor (RHAMM),"Cytoplasm, cell surface, mitotic spindle",Yes (linked to immune infiltration in tumors),"Regulates cell motility, spindle assembly, interacts with BRCA1/2, promotes tumor progression and metastasis",[2],"TCGA, ONCOMINE, CCLE, NCBI Gene, PubMed"
HOXA11,Tumor Suppressor,"Chromatin Remodeling/Epigenetic Regulation, WNT, EMT/Metastasis",chromatin remodeling/epigenetic regulation,Homeobox transcription factor,Nucleus,No,"Regulates gene expression during development, implicated in differentiation and tumor suppression",[General knowledge],"NCBI Gene, GeneCards, PubMed"
OR14C36,Unclear/Not established,Not established,unknown,Olfactory receptor (GPCR family),Cell membrane,No,"G-protein coupled receptor, primarily involved in olfaction; cancer role not established",[General knowledge],"NCBI Gene, GeneCards"
PPRC1,Oncogene,"Metabolism, Cell Cycle, Chromatin Remodeling/Epigenetic Regulation",metabolism,Transcriptional coactivator (PGC-1 family),"Nucleus, cytoplasm",No,"Coactivator for mitochondrial biogenesis and energy metabolism, may promote tumor cell proliferation",[General knowledge],"NCBI Gene, GeneCards, PubMed"
RAD54L,Tumor Suppressor,"DNA Damage Repair, DNA Damage Response",dna damage repair,DNA-dependent ATPase (chromatin remodeling),Nucleus,No,"Involved in homologous recombination and DNA repair, maintains genome stability",[General knowledge],"NCBI Gene, GeneCards, PubMed"
RANBP2,Oncogene,"Ubiquitination/Proteostasis, Nuclear Transport, Chromatin Remodeling/Epigenetic Regulation",ubiquitination/proteostasis,"SUMO E3 ligase, nucleoporin",Nuclear pore complex,No,"Regulates nucleocytoplasmic transport, SUMOylation, and mitosis; implicated in cancer cell proliferation",[General knowledge],"NCBI Gene, GeneCards, PubMed"
SAV1,Tumor Suppressor,"Hippo, Cell Cycle, Apoptosis",hippo,Scaffold protein (WW domain-containing),"Cytoplasm, cell membrane",No,"Core component of Hippo pathway, regulates cell proliferation and apoptosis, suppresses tumor growth",[General knowledge],"NCBI Gene, GeneCards, PubMed"
SMARCA1,Tumor Suppressor,"Chromatin Remodeling/Epigenetic Regulation, DNA Damage Response",chromatin remodeling/epigenetic regulation,Chromatin remodeler (SWI/SNF family),Nucleus,No,"ATP-dependent chromatin remodeling, regulates gene expression and DNA repair, tumor suppressor",[General knowledge],"NCBI Gene, GeneCards, PubMed"
STAMBPL1,Oncogene,"WNT, PI3K, NF-κB, EMT/Metastasis, Angiogenesis, Apoptosis, Ubiquitination/Proteostasis",emt/metastasis,Deubiquitinase (JAMM family),"Cytoplasm, Nucleus",No,"Promotes proliferation, metastasis, EMT, angiogenesis, and inhibits apoptosis via deubiquitination and signaling",[2][3][6][7][8],"NCBI Gene, GeneCards, TCGA"
WNT1,Oncogene,"WNT, Cell Cycle, EMT/Metastasis, MAPK/ERK, PI3K",wnt,Secreted glycoprotein (ligand),"Extracellular, Membrane",No,"Activates canonical WNT/β-catenin signaling, regulates cell fate, proliferation, and migration",[1] (GeneCards),"NCBI Gene, GeneCards"
CHRM3,Oncogene,"MAPK/ERK, PI3K, RTK/RAS, Metabolism",mapk/erk,G protein-coupled receptor (GPCR),Plasma Membrane,No,"Mediates acetylcholine signaling, promotes proliferation and migration in some cancers",[1] (GeneCards),"NCBI Gene, GeneCards"
COL2A1,Tumor Suppressor,"ECM/Metastasis, EMT/Metastasis, Chromatin Remodeling/Epigenetic Regulation",emt/metastasis,Structural protein (collagen),Extracellular Matrix,No,"Major component of cartilage ECM, mutations linked to altered cell adhesion and metastasis",[1] (GeneCards),"NCBI Gene, GeneCards"
DEK,Oncogene,"Chromatin Remodeling/Epigenetic Regulation, DNA Damage Response, Apoptosis, Cell Cycle",chromatin remodeling/epigenetic regulation,Chromatin-associated protein,Nucleus,Yes,"Regulates chromatin structure, transcription, DNA repair, and is linked to immune evasion in some cancers",[1] (GeneCards),"NCBI Gene, GeneCards"
ETV1,Oncogene,"MAPK/ERK, RTK/RAS, Cell Cycle, EMT/Metastasis",mapk/erk,Transcription factor (ETS family),Nucleus,No,"Regulates gene expression for proliferation, differentiation, and metastasis",[1] (GeneCards),"NCBI Gene, GeneCards"
GOT1L1,Unknown,Metabolism,metabolism,Mitochondrial enzyme (transaminase),Mitochondria,No,Catalyzes transamination in amino acid metabolism; cancer role not well established,[1] (GeneCards),"NCBI Gene, GeneCards"
HOXA13,Oncogene,"Chromatin Remodeling/Epigenetic Regulation, EMT/Metastasis, Cell Cycle",chromatin remodeling/epigenetic regulation,Transcription factor (homeobox),Nucleus,No,"Regulates developmental genes, cell proliferation, and is implicated in cancer progression and metastasis",[1] (GeneCards),"NCBI Gene, GeneCards"
ITGA9,Oncogene,"WNT, EMT/Metastasis, Angiogenesis",emt/metastasis,Integrin (cell adhesion receptor),Plasma membrane,No,"Promotes tumor growth, angiogenesis, metastasis, and cancer stem cell-like properties via β-catenin stabilization",[1],"PubMed, COSMIC"
KCNB2,Not classified,"Metabolism, Apoptosis (indirect, via potassium channel function)",metabolism,Voltage-gated potassium channel,"Plasma membrane (neurons, muscle)",No,"Mediates potassium transport, regulates membrane potential and excitability, influences cell survival",[9][6],"STRING, UniProt"
NOTCH4,Oncogene,"Notch, EMT/Metastasis, Apoptosis, Angiogenesis, Cell Cycle",notch,Single-pass transmembrane receptor,"Membrane, cytoplasm, nucleus","Yes (via stemness, EMT)","Regulates cell fate, proliferation, apoptosis, EMT, and stem cell maintenance; promotes tumor progression and metastasis",[7][10],"PubMed, COSMIC"
OR6P1,Not classified,Not established in cancer pathways,unknown,Olfactory receptor (GPCR),Plasma membrane,No,Sensory perception of smell; no established role in cancer,-,"UniProt, NCBI Gene"
PLXNA3,Not classified,EMT/Metastasis (implicated via semaphorin signaling),emt/metastasis,Plexin (semaphorin receptor),Plasma membrane,No,"Mediates semaphorin signaling, influences cell migration and axon guidance; possible role in metastasis",-,"UniProt, NCBI Gene"
SVIL,Not classified,"Cytoskeleton, EMT/Metastasis (implicated)",emt/metastasis,Actin-binding cytoskeletal protein,Cytoplasm,No,"Maintains cytoskeletal integrity, cell shape, and motility; possible role in metastasis",-,"UniProt, NCBI Gene"
TMEM185B,Not classified,Not established in cancer pathways,unknown,Transmembrane protein,"Plasma membrane, ER",No,Unknown; predicted to be involved in membrane transport or signaling,-,"UniProt, NCBI Gene"
TRIM24,Oncogene,"Chromatin Remodeling/Epigenetic Regulation, Cell Cycle, TP53, Hormone Receptor",chromatin remodeling/epigenetic regulation,"E3 ubiquitin ligase, transcriptional co-regulator","Nucleus, cytoplasm","Yes (regulates p53, hormone signaling)","Regulates transcription, chromatin structure, p53 degradation, and hormone receptor signaling; promotes tumorigenesis",[4][5],"COSMIC, UniProt"
